Dark Souls Prepare to Die Edition	"Dark Souls[b] is an action role-playing game developed by FromSoftware and published by Namco Bandai Games. A spiritual successor to FromSoftware's Demon's Souls, the game is the second installment in the Soulsseries. It was released for the PlayStation 3 and Xbox 360 in Japan by FromSoftware in September 2011 and worldwide by Namco Bandai Games in the following month. Dark Souls takes place in the fictional kingdom of Lordran, where players assume the role of a cursed undead character who begins a pilgrimage to discover the fate of their kind. Dark Souls is a third-person action role-playing game. The core mechanic of the game is exploration. Players are encouraged by the game to proceed with caution, learn from past mistakes, or find alternate areas to explore. Dark Souls takes place in a large and continuous open world environment, connected through a central hub area (Firelink Shrine). Players are able to travel to and from areas and explore various paths at will, although certain prerequisites have to be met in order to unlock certain areas"
DC Universe Online	"The player creates a new, original character that interacts with the iconic heroes and villains of DC Comics. Players choose their character's faction (Hero or Villain), gender (male or female), body type (both height and muscularity), personality (comical, flirty, powerful, primal, serious), movement mode (flight, acrobatics, speed or skimming), weapon, and power (fire, ice, gadgets, mental, nature, sorcery, earth, light, electricity, rage, quantum, celestial, munitions, atomic, and water). Numerous hair, skin, and costume types are available, and up to 4 colors can be applied to the color scheme palette. Pre-built templates, inspired by some key DC characters, are available to expedite the character creation process. When the player's character is named, they are thrown into the world of DC Universe Online with the first experience having to fight their way out of a spaceship. The tutorial teaches basic movement and abilities, counter mechanics, and using power and skill points. Eventually the player's character is made an official member of the Justice League or The Society whether hero or villain, where they continue on their missions to increase their level and skill in various content. Daybreak Game Company is working to make DC Universe Online more interactive than standard MMO games, while trying to keep their key elements which include a leveling system, raid instances, endgame progression and inventories. The world is mainly a shared, public space. The public space features dynamically-generated content designed for both hero and villain player characters to progress and fight alongside and against a multitude of iconic DC Comics characters, moving forward with stories, many of which are brought forth from the pages of DC comics)"
METAL GEAR SOLID V THE PHANTOM PAIN	"Metal Gear Solid V: The Phantom Pain[b] is an action-adventure stealth game developed by Kojima Productions and published by Konami. It was released worldwide for Microsoft Windows, PlayStation 3, PlayStation 4, Xbox 360 and Xbox One on September 1, 2015. It is the ninth installment in the series that was directed, written and designed by Hideo Kojima following Metal Gear Solid V: Ground Zeroes, a stand-alone prologue released the previous year, as well as his final work at Konami. Set in 1984, nine years after the events of Ground Zeroes and a decade before the events of the original Metal Gear, the story follows mercenary leader Punished ""Venom"" Snake as he ventures into Soviet-occupied Afghanistan and the Angola–Zaire border region to exact revenge on the people who destroyed his forces and came close to killing him during the climax of Ground Zeroes. It carries over the tagline of Tactical Espionage Operations first used in Metal Gear Solid: Peace Walker."
Stronghold Kingdoms	Stronghold Kingdoms is a Massively multiplayer online real-time strategy game video game with a Medieval castle building theme. It was developed by Firefly Studios and based upon their commercially successful and popular Stronghold series of games. Firefly Studios started development of Stronghold Kingdoms in 2007 as their first entry into the MMO[2] genre. The first Alpha test began in 2009 and was open to 150 players
Space Engineers	"Gameplay of Space Engineers begins with the player selecting or joining a world with specific settings, such as the number of asteroids and the available starting equipment. When creating or editing a world, several advanced options are available to change how the player will interact with the world, and how the worlds will appear. This includes changing the speed with which several tools and machines will work, the size of the player's inventory, and whether procedural generation will be used (effectively making the world infinite). Upon confirming the world settings, a loading screen appears while the world is generated. This screen consists of a random in-game screenshot as a backdrop, the game’s logo, an animated loading icon, and a randomly selected message at the center. The message may be either a helpful gameplay hint, or one of many quotations concerning space, science, and/or engineering. Many of these quotes are from notable scientists such as Isaac Newton, Galileo Galilei, Albert Einstein, as well as authors such as Arthur C. Clarke. Once in-game, the player is given control of a single astronaut (referred to as a ""Space Engineer"") and a set of tools comprising a drill, a welder, and a grinder(if spawn with tools is on). Construction begins by choosing any block from the Engineer’s inventory, and placing it anywhere in open space to create a new voxel grid. Additional blocks can then be added to this grid to create a structure."
Half-Life 2 Deathmatch	"Half-Life 2: Deathmatch is a multiplayer first-person shooter video game developed by Valve Corporation. Released on Steam on November 30, 2004, it uses many of the assets from Half-Life 2 and its Source engine. It features new levels, optimized for multiplayer arena play, and a few new weapons. Also included are portions of the game's source code, which were the basis for many early Source-based multiplayer modifications. The game is the successor to the popular multiplayer component of the original Half-Life, but is offered as a separate product from Half-Life 2. Deathmatch, like Half-Life's multiplayer, does not develop any part of the plot or story of the Half-Life series"
Sid Meier's Civilization IV Beyond the Sword	"Sid Meier's Civilization IV: Beyond the Sword is the second expansion pack of the turn-based strategy video game Civilization IV.[3] The expansion focuses on adding content to the in-game time periods following the invention of gunpowder, and includes more general content such as 11 new scenarios, 10 new civilizations, and 16 new leaders"
Baldur's Gate II Enhanced Edition	"Baldur's Gate II: Shadows of Amn is a fantasy role-playing video game developed by BioWare and published by Interplay Entertainment. It is the sequel to Baldur's Gate (1998) and was released for Microsoft Windows in September 2000. Like Baldur's Gate, the game is set in the Forgotten Realms, a fantasy campaign setting, and is based on the Advanced Dungeons & Dragons 2nd edition rules. The game, which is powered by BioWare's Infinity Engine, uses an isometric perspective and pausable real-time gameplay. The player controls a party of up to six characters, one of whom is the player-created protagonist, while the others are certain characters recruited from the game world. Set in the fictional Forgotten Realms campaign setting, Baldur's Gate II takes place south of the events of Baldur's Gate, being set in the country of Amn, mainly in and around Athkatla, the City of Coin. The game opens shortly after the events of Baldur's Gate and continues the story of the protagonist, Gorion's Ward, whose unique heritage has now gained them the attention of Jon Irenicus, a powerful mage. The storyline revolves around the machinations of Irenicus and the protagonist's encounters with him. The game's development began in January 1999. BioWare set out to improve upon the first Baldur's Gate in every way possible. From a list of constructive criticism (compiled from the suggestions of fans, reviews, and internal suggestions) a list of features to be added to the game was distilled: some of these were 800 x 600 resolution, 3D support, and character kits. In Baldur's Gate, the game's engine and content were being developed at the same time; whereas in Baldur's Gate II, the engine was running from the start."
Might & Magic Heroes VI	"Might & Magic Heroes VI is a turn-based strategy video game for Microsoft Windows developed by Black Hole Entertainment and published by Ubisoft. Some patches and downloadable content were developed by Limbic Entertainment,[3][4] while the standalone expansion Shades of Darkness was developed by Virtuos.[5] It is the sixth installment in the Heroes of Might and Magic series, and was released on October 13, 2011, coinciding with the 25th anniversary of the Might and Magic franchise.[6] Heroes VI acts as a prequel to Heroes of Might and Magic V, occurring almost five centuries earlier, and is set in the fictional world of Ashan. The story follows the five heirs to the Griffin dynasty in their quests to repel a demon invasion and assist or impede Michael, a legendary Archangel general plotting to revive an ancient war. As in previous Heroes of Might and Magic titles, the player can choose between single-player or multiplayer modes of play, and controls a number of heroes and towns associated with various factions, commanding armies of creatures between tactical overland exploration and a turn-based combat system to satisfy each scenario's victory conditions. Heroes VI alters some of the series' long-standing conventions, overhauling its chance-based skills system as well as removing the old ""magic guild"" spell system and replacing both with a hero-based ""talents"" tree. The game also reduced the number of resources from seven to four in its economics model,[7][8] and introduced new mechanics, including a points-based reputation system, army-less hero travel, and increased area control by faction-affiliated towns"
Chivalry Medieval Warfare	"Chivalry has similar gameplay mechanics to Age of Chivalry, a Half-Life 2 mod created by the same developer, Torn Banner Studios.[1][2] Combat is primarily melee,[6] carried out from either a first person or third person perspective using medieval implements of war: swords, maces, longbows, and other weaponry of the time are used to hack, smash, and rain arrows down upon enemies.[2] The game also features ballistae, catapults, and boiling oil to use on enemies and their fortifications.[6] Online matches are affected through objective-based gameplay, such as breaching a castle gate with a battering ram or looting a foe's camp.[2] While the game does not have a single-player campaign, there are plans to create an offline mode in the future. In the game, the fictional nation of Agatha is in a civil war, with two factions – the Agatha Knights and the Mason Order – vying for control of the region.[7] Players pick their sides and choose from four character classes, each with a different set of skills and choice of weaponry"
7 Days to Die	"In 7 Days to Die, the player spawns into a randomly-generated world or the present world of Navezgane, Arizona, with the objective of surviving for as long as possible against the elements and the zombie hordes. As a survival game, the player character is in constant need of water and food for sustenance, as well as being vulnerable to injury and illness. The game is voxel-based (similar in some respects to Minecraft), allowing for simple building, and destruction of objects in a physics-simulated environment (for example, building a structure with no support such as pillars and walls can lead to its collapse).[1][2] Objects in the world degrade through use, so the player has to search for or make new tools as the game progresses. The player can also gather and create materials—from nature and the remnants of human civilization—to construct these necessary items.[3][4]"
Call of Duty Black Ops	"Call of Duty: Black Ops is a first-person shooter video game,[1] developed by Treyarch and published by Activision. It was released worldwide on November 9, 2010 for Microsoft Windows, the PlayStation 3, Xbox 360,[2]and Wii,[3] with a separate version for Nintendo DS developed by n-Space.[4][5] Aspyr later released the game for OS X on September 27, 2012.[6] It is the seventh title in the Call of Duty series and the third to be developed by Treyarch. It serves as the sequel to Call of Duty: World at War. Set in the 1960s during the Cold War, the game's campaign follows CIA operative Alex Mason as he attempts to recall certain memories in combat in order to locate a numbers station. This station is due to transmit broadcasts to sleeper agents who are bound to use chemical weapons across the United States. Mason and CIA operative Jason Hudson are the game's main playable characters, as well as Red Army soldier Viktor Reznovin only one mission. Locations featured in the game include Cuba, Russia, United States, Kazakhstan, Hong Kong, Laos, Vietnam, and the Arctic Circle. The multiplayer of Black Ops features multiple objective-based game modes that are playable on 14 different maps included with the game. Improvements to loadout options and killstreak rewards are made. A form of virtual currency, COD Points, allows players to purchase weapons and customization options for their in-game character, as well as attachments and customization options for their weapon"
BioShock Infinite	"The game is set in the year 1912 and follows its protagonist, former Pinkerton agent Booker DeWitt, who is sent to the airborne city of Columbia to find a young woman, Elizabeth, who has been held captive there for most of her life. Though Booker rescues Elizabeth, the two become involved with the city's warring factions: the nativist and elite Founders that rule Columbia and strive to keep its privileges for White Americans, and the Vox Populi, underground rebels representing the underclass of the city. During this conflict, Booker learns that Elizabeth possesses strange powers to manipulate ""Tears"" in the space-time continuum that ravage Columbia, and soon discovers her to be central to the city's dark secrets. the player controls Booker Dewitt throughout the game, eventually working with the AI-controlled Elizabeth. Like previous BioShock games, the player uses a combination of weapons, clothing called Gear that offer unique attributes, and psychokinetic powers granted through Vigors. Elizabeth's powers can also be used to help fight hostile forces. In contrast to the limited spaces of the underwater city of Rapture, the openness of Columbia provides for more dynamic combat, including combat that takes place aboard the city's Sky-Line rollercoaster-like rail system. Downloadable content for the game includes a story-based mission, Burial at Sea, that links Infinite's story to that of the original BioShock game"
Heroes & Generals	"The player starts with a soldier from each faction (United States, Soviet Union, Germany) and can buy additional soldiers with in-game credits. These soldiers are equipped with a default rifle and can play the Encounter game mode immediately. When entering a battle, the player is presented with an interactive map, showing terrain and which team controls which control points. In the Skirmish and Encounter game modes, the player must click on the spawn point of their team (or called faction) and can choose whether to spawn on foot or in a vehicle. In the Assault game mode, the same rules apply, except players can also spawn on control points captured by their team. Teams will always consist of soldiers from the same nation, unlike some World War II games that have teams of mixed nationalities. The game includes World War II era tanks, planes, and land vehicles. Infantry units are also a vital game play aspect. Tactical decisions made by officers in grand campaigns affect in-game support, reinforcements, and logistics. Players will encounter a variety of terrain, from fields and countryside to large cities.[3] The game features three game modes for the FPS-part of the game: Assault, Skirmish and Encounter"
Dungeon Defenders	"Dungeon Defenders is a mix of tower defense, role-playing, and action-adventure where one to four players work together to protect one or more Eternia Crystals from being destroyed by waves of enemies which include goblins, orcs, kobolds, ogres, and wyverns. The game features a number of levels, consisting of around five total waves, through its campaign mode, or other levels as part of challenges; some of these levels may feature a final wave that includes a boss battle against a unique foe. The player characters defend crystals by either magically creating, maintaining, and upgrading towers or other defensive elements that damage or divert the enemy monsters, or by using melee and ranged attacks to defeat enemies directly. On easier difficulties, players have an indefinite amount of time prior to a wave to study the level's map to see where monsters will come from and the type or number of monsters, to place traps and defenses, and to manage the characters' equipment. Traps and defenses are limited by the available mana that the character has - more mana can be obtained by defeating monsters or opening chests that appear between waves - as well as a total ""defense value"" for the level, limiting the number of traps that can be placed. The characters can be damaged by enemy attacks, and can be killed in battle but will respawn after a few seconds, unless hardcore mode is selected. If an Eternia Crystal has taken too much damage, it will be destroyed and the players will lose that level. Successfully defending a wave will earn the characters experience points based on the difficulty plus additional bonuses, namely preventing any damage to the crystals, preventing damage to your character, and only using weapons to kill monsters; successfully completing all waves of a level will earn the players a large banked mana boost. Monsters will also drop items that can be sold for additional banked mana."
Call of Duty Ghosts - Multiplayer	"The multiplayer in Call of Duty: Ghosts features changes from that of previous Call of Duty games as some new mechanics have been added to it. Maps now have areas that can be altered or destroyed. There is a nuke-like kill streak reward, the KEM Strike. You can get the ODIN kill streak by either getting a certain amount of kills or you can get it by killing the top player on the other team and then completing various challenges after picking up a blue briefcase that is dropped. The sniper rifle scopes also have new ""dual render technology"" allowing the player to see around the outside of the scope (although blurred) when zoomed in. On October 3, a new multiplayer type was revealed, called Squads. This features a squad that you build and you can face other squads around the world. Your squad can be leveled up and will act like a true individual. ""Octane"", ""Prison Break"", ""Tremor"", ""Freight"", ""Stormfront"", ""Siege"", ""Warhawk"", ""Sovereign"", ""Overlord"", ""Flooded"", ""Strikezone"", ""Whiteout"", ""Stonehaven"" and ""Chasm"" are the maps that are in Call of Duty: Ghosts so far. The dynamic map, ""Free Fall"", was a pre-order bonus. The game now features playable female soldiers"
Don't Starve	"Don't Starve is an open world survival video game developed by the Canadian indie company Klei Entertainment. The game was initially released via Valve Corporation's Steam software for Microsoft Windows, OS X, and Linux on April 23, 2013.[1] A PlayStation 4 port, renamed Don't Starve: Giant Edition, became available the following year (with PlayStation Vita and PlayStation 3 versions released on September 2014 and June 2015 respectively, and an Xbox One version released in August 2015).[2][3] Don't Starve for iOS, renamed Don't Starve: Pocket Edition was released on July 9, 2015.[4] Android version was released on October 20, 2016. Downloadable content titled Reign of Giants was released on April 30, 2014, and a multiplayer expansion called Don't Starve Together became free for existing users on June 3, 2015.[5] A Nintendo Switch port came out on April 12, 2018.The game follows a scientist named Wilson who finds himself in a dark, dreary world and must survive as long as possible. To this end, the player must keep Wilson healthy, fed, and mentally stable as he avoids a variety of surreal and supernatural enemies that will try to kill and devour him. The game's Adventure mode adds depth to the sparse plot and pits Wilson against the game's antagonist, Maxwell"
Deus Ex Human Revolution	"Deus Ex: Human Revolution is an action role-playing video game developed by Eidos Montréal and published worldwide by Square Enix in August 2011 for Microsoft Windows, PlayStation 3 and Xbox 360: a version for OS X released the following year. It is the third game in the Deus Ex series, and a prequel to the original Deus Ex. The gameplay—combining first-person shooter, stealth and role-playing elements—features exploration and combat in environments connected to multiple city-based hubs, in addition to quests that grant experience and allow customization of the main character's abilities with items called Praxis Kits. Conversations between characters feature a variety of responses, with options in conversations and at crucial story points affecting how some events play out. Set in the year 2027, Human Revolution focuses on ex-SWAT officer Adam Jensen, who is employed as security officer for Sarif Industries, a company on the leading edge of advanced and controversial artificial organsdubbed ""augmentations"". An attack on Sarif Industries that apparently kills researcher and Adam's ex-girlfriend Megan Reed also leaves Adam critically injured. To save him, company CEO David Sarif subjects him to an extensive augmentation procedure: six months later, now recovered and possessing advanced augmentations, Adam sets out to pursue his attackers and the shadowy organization behind them. The story explores themes of transhumanism, the growing power of megacorporations, and their impact on social class. It also uses the series' recurring cyberpunk setting and conspiracy theory motif."
Neverwinter	"Players can become one of eight Dungeons & Dragons character classes and form groups of up to five player characters (PCs). Neverwinter is based on a modified version of the Dungeons & Dragons 4th edition rules set. This includes the use of healing powers and action points, the latter of which is implemented through a system referred to as dailies, allowing a player to perform a special ability by accumulating enough action points through combat. A player-created content system codenamed ""Foundry"" allows players to create their own stories and quests."
Just Cause 2	"Just Cause 2 is a 2010 open world action-adventure video game developed by Avalanche Studios, published by Eidos Interactive and distributed by Square Enix for Microsoft Windows, PlayStation 3 and Xbox 360. The sequel to 2006's Just Cause, it was powered by Avalanche Studios' Avalanche Engine. It features Rico Rodriguez, a major operative of the fictional Agency who arrives at Panau (a fictional dystopian island nation in Maritime Southeast Asia) to overthrow dictator Pandak ""Baby"" Panay and confront former mentor Tom Sheldon. The gameplay involves Rico fighting hostile militants with guns and a grappling hook, enabling players to tether objects to each other and slingshot into the air with a parachute. Just Cause 2 introduces the Chaos System, in which players must complete missions and destroy government property on Panau for Chaos points. These points are essential for story progression."
