Star Wars - Battlefront II	"Star Wars Battlefront II is an action shooter video game based on the Star Wars film franchise. Star Wars Battlefront II features a single-player story mode, a customizable character class system, and content based on The Force Awakens and The Last Jedi movies.[5] It also features vehicles and locations from the original, prequel, and sequel Star Wars movie trilogies. It also features heroes and villains that can be played."
SimCity 4 Deluxe	"SimCity 4 is a city-building simulation computer game developed by Maxis, a subsidiary of Electronic Arts. The game allows players to create a region of land by terraforming, and then to design and build a settlement which can grow into a city. Players can zone different areas of land as commercial, industrial, or residential development, as well as build and maintain public services, transport and utilities. For the success of a city, players must manage its finances, environment, and quality of life for its residents. SimCity 4 introduces night and day cycles and other special effects for the first time in the SimCity series. External tools such as the Building Architect Tool (BAT) allow custom third-party buildings and content to be added to the gameplay."
Half-Life 2 Episode One	"Half-Life 2: Episode One is a first-person shooter video game, the first in a series of episodes that serve as the sequel to the 2004 Half-Life 2.The game's events take place immediately after those in Half-Life 2, in and around war-torn City 17. Episode One follows scientist Gordon Freeman and his companion Alyx Vance as they fight in humanity's continuing struggle against the alien civilization known as the Combine. When the story begins, Gordon wakes up outside the enemy's base of operations, the Citadel, after being left unconscious from the concluding events of Half-Life 2. During the course of the game, Gordon travels with Alyx as they attempt to evacuate the city. "
Blood Bowl Chaos Edition	"Blood Bowl is a fantasy football game created by Jervis Johnson for the British games company Games Workshop as a parody of American Football.Blood Bowl is a two-player, turn-based board game that typically uses 28 mm miniatures to represent a contest between two teams on a playing field. A board containing a grid overlay represents the field. Using dice, cards, and counters, the players attempt to score higher than each other by entering the opponent's end zone with a player who possesses the ball."
Kingdoms of Amalur Reckoning	"Kingdoms of Amalur features five distinct regions, four playable races, and three class trees with 22 abilities per tree.[4] The four playable races are the Almain (Civilized Humans), the Dokkalfar (Dark Elves), the Ljosalfar (Light Elves), and the Varani (Nomadic Humans).[citation needed] The player starts off as a ""Fateless"", but can afterwards choose a class among the three available in the game, which are called Might, Finesse, and Sorcery; they correspond to the fighter, rogue, and mage classes respectively. "
Hearts of Iron III	"Hearts of Iron III is a grand strategy wargame developed by Paradox Development Studio and published by Paradox Interactive.Hearts of Iron III allows the player to take control of almost any nation that existed during the period of 1936–1948, guiding it through World War II.[4] With a variety of decisions regarding the armed forces, production, research, diplomacy, politics and espionage all being a focus of the game."
Reign Of Kings	"Reign of Kings is a medieval sandbox game where you gather resources, build homes and strongholds, then clash with your competition in brutal, gloriously gory combat. Impale them, burn them, chop off their limbs and if they surrender, take them to the gallows to behead or hang them. The grim darkness of the medieval past has never been such fun!"
L.A. Noire	"L.A. Noire is a neo-noir detective action-adventure video game developed by Team Bondi and published by Rockstar Games. L.A. Noire is an action-adventure neo-noir crime game played from a third-person perspective. Players complete cases—linear scenarios with set objectives—to progress through the story. The game also features a mode which allows the player to freely roam the open world and engage in optional activities.[11] The world features multiple landmarks, which are all based on real monuments from 1940s Los Angeles."
Wargame AirLand Battle	"Wargame: AirLand Battle is a real-time strategy video game developed by Eugen Systems and published by Focus Home Interactive, released on May 29, 2013. Wargame's playable factions are the Warsaw Pact, which is subdivided into the Soviet Union, Communist Poland, East Germany, and Czechoslovakia; and NATO, which is subdivided into the United States of America, United Kingdom, France, West Germany, Canada, Sweden, Norway, and Denmark. Players can choose various units from the subfactions of the side they are playing on, unlocking new units or improved variants as they progress. "
Wargame Red Dragon	"Wargame: Red Dragon is a real-time strategy video game developed by Eugen Systems and published by Focus Home Interactive, released on April 17, 2014. It is the sequel to the 2013 Wargame: AirLand Battle.Wargame: Red Dragon includes 21 nations and over 1,900 units to play with. The game is set during an alternate history Cold War where the Soviet Union doesn't collapse. The timeline cuts off at 1996, which is the latest year a unit could be from. The battlefield is viewed from a top-down perspective, giving the player an overview of the action. The player can decide which units they want to deploy before a battle, creating a deck of specific individual units. The player can choose from infantry, various forms of armored units, air forces, and naval forces, with further customization available, e.g. choosing between infantry with anti-aircraft or anti-armor capabilities, or whether to deploy air-superiority aircraft or ones suited for supporting ground forces. The opposing sides will typically start on opposite sides of the battlefield, with both parties being awarded an initial amount of deployment points that determine how many units they can spawn at the start of the battle. "
Metro Last Light	"Metro: Last Light is a post-apocalyptic-themed, first-person shooter video game with stealth and survival horror elements. As a first-person shooter, Metro: Last Light features a variety of firearms, some fictional and some based on real weapons, which the player uses in combat. The game's protagonist, Artyom, also has the ability to kill an enemy directly with his melee weapon.[2] Artyom has three weapons slots. Players can put any weapon into these slots without restriction.[3] Players have access to four different secondary weapons, including throwing knives, claymores, incendiary grenades, and hand grenades.[6] Mutants do not possess weapons and tend to physically attack the player in swarms, while humans fight with the same firearms available to the player. The player can knock out or kill most human enemies instead of shooting them, using stealth to avoid detection."
WAKFU	"Wakfu features a turn-based combat system similar to Dofus, it also contains elements inspired by tactical RPG. Players walk around with the screen scrolling while they move, as opposed to Dofus where the camera is static and characters move to a new area by walking to the edge of the current screen. Some parts of the game are player-managed: Governmental affairs such as organising militias or elections for positions like governor are performed by players themselves. Another similar addition is environmental management by players. Players can maintain resource levels by planting seeds as they harvest crops and hunt wildlife or simply take what they want, decreasing availability for other players, If players manage to maintain this they will earn various Nation bonuses. Since 2014 a new feature came to the World of twelve, The Riktus Clan. "
Assassin's Creed Revelations	"Assassin's Creed: Revelations is a 2011 action-adventure video game developed by Ubisoft Montreal and published by Ubisoft. The plot is set in a fictional history of real world events and follows the centuries-old struggle between the Assassins, who fight for peace with free will, and the Templars, who desire peace through control. The framing story is set in the 21st century and features the series protagonist Desmond Miles who, with the aid of a machine known as the Animus, relives the memories of his ancestors to find a way to avert the 2012 apocalypse. "
Guild Wars	"Guild Wars is a massively multiplayer online action role-playing game developed by ArenaNet, a subsidiary of South Korean game publisher NCSOFT. Players use a 3D avatar to interact with the world around them. The game predominantly features a third-person perspective but also has the option of first-person. These characters are able to walk/run and interact with other characters through chat. They can also perform actions such as fighting and picking up objects, as well as interacting with special objects."
Realm of the Mad God	"Realm of the Mad God is a massively multiplayer online shooter video game co-created by Wild Shadow Studios (later acquired by Kabam) and Spry Fox in 2011, and later sold to Deca Games by Kabam in July 2016. The game has been described as a ""massively-multiplayer cooperative bullet hell shooter"" with an 8-bit pixelated art style.[3] Players control characters who have been transported to the realm of Oryx (the titular Mad God) to become food for his many minions and abominations, which the players must dispatch. Central to the design of the game is the fact that character death is permanent. "
ArcheAge	"ArcheAge is an MMORPG developed by Korean developer Jake Song (former developer of Lineage) and his development company, XL Games.  Archeage features a zoneless world with first or third person view."
Sniper Elite 3	"Sniper Elite III is a third-person tactical shooter stealth video game developed by Rebellion Developments and published by 505 Games. The sniper rifle is the player's primary weapon, though additional weapons, including submachine guns and pistols, silenced or not depending on the situation, are available. In addition to hand grenades, the player can deploy tripwire booby traps, land mines and dynamite. Binoculars can be used to tag enemies, displaying their position and movements. The player-character must hold their breath to properly line up the shot. A red icon appears in the scope, marking the projected point of impact. There are weapon parts spread out all over the game, found when looting dead enemies, allowing players to customize their weapons in the predeployment menu; the menu also allows equipment loadouts."
FreeStyle2 Street Basketball	"FreeStyle Street Basketball (FSSB) is a massively multiplayer online sports game made by JC Entertainment and with cel-shaded graphics. It is a fast paced, arcade styled representation of half court streetball, self-described as being Hip-Hoop.[4] Players team up with one another to challenge other online players to matches of basketball that are characterized by high tempo, freedom of movement, and a premium placed on synergy and teamwork. Players can also create clubs and enter club matches, play in a single player story mode, roam around in Open Court mode, drop and add skills as needed, and choose from millions of different outfits to express themselves due to the sheer quantity of wearable items in the ingame shop."
Castle Crashers	"Castle Crashers is a 2D beat 'em up video game developed by The Behemoth. It features music created by members of Newgrounds. The Xbox 360 version was released on August 27, 2008 via Xbox Live Arcade as part of the Xbox Live Summer of Arcade. The PlayStation 3 version was released in North America on August 31, 2010 and November 3, 2010 in Europe via the PlayStation Network. A Microsoft Windows version, exclusive to Steam, was announced on August 16, 2012.[2] The game is set in a fictional medieval universe in which a dark wizard steals a mystical gem and captures four princesses. Four knights are charged by the king to rescue the princesses, recover the jewel, and bring the wizard to justice. Castle Crashers was well received by critics on all platforms on which it was released. The Xbox 360 version holds a score of 82.73% at GameRankings and 82/100 at Metacritic, while the PlayStation 3 version averages 88.67% and 85/100 at the same sites. The PC version holds a score of 7.8 on Metacritic, indicating generally favorable reviews. The game was a commercial success, and the Xbox 360 version has sold over.On June 15, 2015, The Behemoth announced Castle Crashers Remastered, a remastered version of the game for Xbox One, while the Steam version received it in the form of a free update.The remastered version features higher quality textures, uncapped frame-rate, performance improvements, and an additional mini-game."
Alan Wake	"Alan Wake is an action-adventure video game developed by Remedy Entertainment and published by Microsoft Studios, released for the Xbox 360 and Microsoft Windows. The story follows best-selling thriller novelist Alan Wake, as he tries to uncover the mystery behind his wife's disappearance during a vacation in the small fictional town of Bright Falls, Washington, all while experiencing events from the plot in his latest novel, which he cannot remember writing, coming to life.In its pacing and structure, Alan Wake is similar to a thriller television series, with episodes that contain plot twists and cliffhangers. The game itself consists of six episodes, and the fiction is continued by two special episodes, titled ""The Signal"" and ""The Writer"", that were made available as downloadable content (DLC) within the same year of the game's release. Together, they make the first season of a possibly longer story. Additionally, a six-episode live-action web series called Bright Falls acts as a prequel to the game, and a number of related books also expand upon the Alan Wake story. Chiefly written by Sam Lake, Alan Wake took over five years to create—an unusually long development time in the game industry. The game received positive reviews from critics, and is often praised for its visuals, sound, narrative, pacing, and atmosphere. Alan Wake was awarded the first spot in Time magazine's list of the top 10 video games of 2010.[1] Alan Wake's American Nightmare, a full stand-alone title, was released in February 2012 on the Xbox Live Arcade service. A sequel was in development but was cancelled. However, the scrapped sequel became the foundation and inspiration of Remedy's next title, Quantum Break."
Firefall	"Firefall is a rock band that formed in Boulder, Colorado in 1974. It was founded by Rick Roberts, who had been in the Flying Burrito Brothers, and Jock Bartley, who had been Tommy Bolin's replacement in Zephyr. The band's biggest hit single, ""You Are the Woman"", peaked at No. 9 on the Billboard charts in 1976. Other hits included ""Just Remember I Love You"" (#11 in 1977), ""Strange Way (nl)"" (#11 in 1978), ""Cinderella"" (#34 in 1977), ""Headed for a Fall"" (#35 in 1980), and ""Staying with It"" (#37 in 1981) with female vocalist Lisa Nemzo."
Half-Life 2 Lost Coast	"Half-Life 2: Lost Coast (stylized as H?LF-LIFE2: LOST COAST) is an additional level for the 2004 first-person shooter video game Half-Life 2. Developed by Valve Corporation, it was released on October 27, 2005, through the Steam content delivery service as a free download to owners of the Microsoft Windows version of Half-Life 2. Lost Coast serves as a technology demonstration, specifically showcasing the high-dynamic-range rendering implemented in the Source engine. The level was designed with a variety of appropriate environments to emphasize these effects. In addition, Lost Coast was the first video game developed by Valve to allow developers to explain various elements of design as the player progresses through the level. Lost Coast follows Half-Life protagonist Gordon Freeman as he travels up a coastal cliff to destroy a Combine artillery launcher in a monastery, which is firing on a nearby town. The Lost Coast level was originally created for Half-Life 2, but was ultimately removed from the game. As a result, it has several minor story details that were not included in Half-Life 2. The level received a generally positive reception, and there was consensus among reviewers that the new features included in Lost Coast should be integrated into future games released by Valve."
The Mighty Quest For Epic Loot	"The Mighty Quest for Epic Loot was a free-to-play action role-playing video game developed by Ubisoft Montreal. The game combined castle building and dungeon crawling mechanics: each player built a castle filled with traps and monsters and then attacked other players' castles, earning gold and equipment. While the castle attacks were single player affairs, the game required the player to be online as the castles they attacked were those of other players."
Age of Wonders III	"Age of Wonders III is a 4X turn-based strategy video game developed and published by Dutch developer Triumph Studios. It is the fourth game in the Age of Wonders series, following Age of Wonders, Age of Wonders II: The Wizard's Throne and Age of Wonders: Shadow Magic released in 1999, 2002, and 2003 respectively. It was released on March 31, 2014 through digital distribution, as well as through retail in select territories for Microsoft Windows. A port to Linux and OS X was released on April 14, 2015. The game is set in a high fantasy fictional setting, where players take the role of a leader to explore the world, interacting with other races and kingdoms, both diplomatically and through warfare while progressively expanding and managing their empire. It features a new graphics engine for the series, in addition to an updated soundtrack. The gameplay has also been updated, featuring a new role-playing style leader class based system and interchangeable choices of strategy and appearances for each playable race. It also supports online and local multiple player modes and a level editor along with a new story driven single player campaign mode."
F1 2012	"F1 2012 is a video game developed by Codemasters based on the 2012 Formula One season'. It was announced on 18 March 2012,[3] co-inciding with the first race of the 2012 season. The game was released in September 2012[2]. It uses the EGO Engine. This was also the first game by Codemasters released under their ""Codemasters Racing"" label, which was used until 2016. As well as the new young driver test mode, F1 2012 features a new ""Champions Mode"", in which the six World Champions competing in the 2012 season — Kimi Räikkönen, Lewis Hamilton, Jenson Button, Sebastian Vettel, Fernando Alonso and Michael Schumacher — are styled after traditional end-of-level video gaming bosses, with the player challenged to beat them while racing in conditions that suit each driver."
Europa Universalis III	"The player controls a nation and handles matters concerning war, diplomacy, trade, and economy. The original game without expansions starts in 1453, right after the Fall of Constantinople, and continues to 1789, just past the beginning of the French Revolution. The expansion Napoleon's Ambition extends the end game year forward to 1821, whereas the expansion In Nomine moves the starting year back to 1399, making it the longest as far as gameplay time in the series thus far. Europa Universalis III has a 3D engine that requires the system to meet the Pixel Shader 2.0 specification. The map has 1,700 land and sea provinces encompassing most of the world, with 250 playable historical nations. The game also uses elements of other Paradox games such as Crusader Kings, Victoria, and Hearts of Iron II."
The Crew	"The Crew is an online-only racing video game developed by Ivory Tower and Ubisoft Reflections and published by Ubisoft for Microsoft Windows, PlayStation 4 and Xbox One, with an Xbox 360 port developed by Asobo Studio. The Crew is a racing game set in a persistent open world environment for free-roaming across a scaled-down recreation of the contiguous United States.[4] The map is split into five regions: The Midwest, East Coast, The South, Mountain States, and West Coast. Each region has its own unique geographical features. Six main cities (one in each region, two in the Midwest) are featured in the game: Detroit and Chicago in the Midwest, New York City on the East Coast, Miami in The South, Las Vegas in the Mountain States, and Los Angeles on the West Coast. Various other cities, namely St. Louis, Washington, D.C., New Orleans, Dallas, Salt Lake City, Santa Fe, San Francisco, and Seattle, are also featured in the game. Over thirty smaller cities and towns line the countryside, such as Nashville, Norfolk and others. It takes approximately 45 minutes in real time to drive from coast to coast in-game."
GameMaker Studio	"GameMaker is primarily intended for making games with 2D graphics, allowing out-of-box use of raster graphics, vector graphics (via SWF),[2] and 2D skeletal animations (via Esoteric Software's Spine)[3][4] along with a large standard library for drawing graphics and 2D primitives.[5] While the software allows for use of 3D graphics, this is in form of vertex buffer[6] and matrix functions, and as such not intended for novice users."
STAR WARS Knights of the Old Republic II The Sith Lords	"Knights of the Old Republic II is a role-playing video game played from a third-person view that features pausable real-time combat.[1] Combat and interactions with the environment and non-player characters in Knights of the Old Republic II are based on the d20 System as in Star Wars: Knights of the Old Republic.[2] The game starts with a character creation screen with several choices to make, and there is also an option of letting the game do it automatically.[3] There are 30 new Force powers, which are manifestations of the Force, in Knights of the Old Republic II.[4] Like its predecessor, the game has several minigames, including swoop bike racing and a card game called Pazaak.[5] The interface has been streamlined from the original game and party management has been made easier; for example, the player can switch between two selected weapon sets in the menu.[3] As in the first game, the player can choose to align with either the light side or the dark side. Choosing dialogue options that are respectful and empathetic gives the protagonist light side points, while options that are egotistic and evil result in dark side points."
Counter-Strike Condition Zero Deleted Scenes	"Condition Zero: Deleted Scenes is what is left over from Ritual Entertainment's stage of development, a series of eighteen unconnected single-player missions. Deleted Scenes was originally the focus on the game with standard multiplayer included. However, after declaring the game gold and handing out review copies of Ritual's work, Valve saw an average review score of around 60%. The companies retracted the gold status and work on Condition Zero was essentially begun again. Ritual's share of development was dropped, and Turtle Rock Studios eventually made its own version. The final game contained Ritual's single-player portion, called Deleted Scenes, along with Turtle Rock's version. Several weapons from the ""lost co"" have made an appearance in Deleted Scenes, including the M72 Light Anti-Armor Weapon, and the M60 machine gun. Some are limited to the AI terrorists, such as the machete and Rogue Entertainment's controversial suicide belt. Some reconnaissance weapons including the blow torch, radio, fiber-optic camera and remote control bombs. Players can also carry up to three grenades instead of the usual one. Moreover, the power of players' Kevlar Armor is boosted, better protecting players from many projectiles and bullets."
Arma 2	"ARMA 2 is a tactical shooter focused primarily on infantry combat, but significant vehicular and aerial combat elements are present. The player is able to command AI squad members which adds a real-time strategy element to the game. This is further enhanced by the high command system, which allows the player to command multiple squads using the map. ARMA 2 is set primarily in the fictional Eastern European nation of Chernarus (meaning ""Black Rus""). The Chernarussian landscape is based heavily on the Czech Republic; the home country of the developer. ARMA 2, plus all expansions, features eleven distinct armed factions, each with their own vehicles and weapons. Caught in the middle are the Chernarussian and Takistani civilians. The factions included in Arma 2 are: USMC, Armed Forces of the Russian Federation, Chernarussian Defense Forces (CDF), Chernarussian Movement of the Red Star (ChDKZ), National Party (NAPA), and the citizens of Chernarus."
