Dota 2	"Dota 2 is a multiplayer online battle arena (MOBA) video game developed and published by Valve Corporation. The game is a sequel to Defense of the Ancients (DotA), which was a community-created mod for Blizzard Entertainment's Warcraft III: Reign of Chaos and its expansion pack, The Frozen Throne. Dota 2 is played in matches between two teams of five players, with each team occupying and defending their own separate base on the map. Each of the ten players independently controls a powerful character, known as a ""hero"", who all have unique abilities and differing styles of play. During a match, players collect experience points and items for their heroes to successfully defeat the opposing team's heroes in player versus player combat. A team wins by being the first to destroy a large structure located in the opposing team's base, called the ""Ancient""."
Counter-Strike Global Offensive	"Counter-Strike: Global Offensive (CS:GO) is a multiplayer first-person shooter video game developed by Hidden Path Entertainment and Valve Corporation. It is the fourth game in the Counter-Strike series and was released for Microsoft Windows, OS X, Xbox 360, and PlayStation 3 in August 2012, with the Linux version released in September 2014. The game pits two teams against each other: the Terrorists and the Counter-Terrorists. Both sides are tasked with eliminating the other while also completing separate objectives, the Terrorists, depending on the game mode, must either plant the bomb or defend the hostages, while the Counter-Terrorists must either prevent the bomb from being planted, defuse the bomb, or rescue the hostages. There are eight game modes, all of which have distinct characteristics specific to that mode."
Team Fortress 2	"Team Fortress 2 (TF2) is a team-based multiplayer first-person shooter video game developed and published by Valve Corporation. It is the sequel to the 1996 mod Team Fortress for Quake and its 1999 remake, Team Fortress Classic. It was released as part of the video game bundle The Orange Box in October 2007 for Microsoft Windows and the Xbox 360.[1] A PlayStation 3 version followed in December 2007.[2] The game was released for Windows as a standalone entry in April 2008 and was updated to support OS X in June 2010 and Linux in February 2013. It is distributed online through Valve's digital retailer Steam, with retail distribution being handled by Electronic Arts. In Team Fortress 2, players join one of two teams comprising nine character classes, battling in a variety of game modes including capture the flag and king of the hill. The development is led by John Cook and Robin Walker, creators of the original Team Fortress. Announced in 1998, the game once had more realistic, militaristic visuals and gameplay, but this changed over the protracted nine-year development. After Valve released no information for six years, Team Fortress 2 regularly featured in Wired News' annual vaporware list among other ignominies.[3] The finished Team Fortress 2 has cartoon-like visuals influenced by the art of J. C. Leyendecker, Dean Cornwell, and Norman Rockwell,[4] and uses Valve's Source game engine."
Counter-Strike	"Counter-Strike (also known as Half-Life: Counter-Strike) is a first-person shooter video game developed by Valve Corporation. It was initially developed and released as a Half-Life modification by Minh ""Gooseman"" Le and Jess Cliffe in 1999, before Le and Cliffe were hired and the game's intellectual property acquired. Counter-Strike was released by Valve on the Microsoft Windows platform in 2000. The game spawned a franchise, and is the first installment in the Counter-Strike series. Several remakes and ports of Counter-Strike have been released on the Xbox console, as well as OS X and Linux. It is commonly referred to as Counter-Strike 1.6 to distinguish it from other titles of the series, 1.6 being the final major software update the game received. Set in various locations around the globe, players assume the roles of members of combating teams of the governmental counter-terrorist forces and various terrorist militants opposing them. During each round of gameplay, the two teams are tasked with defeating the other by the means of either achieving the map's objectives, or else eliminating all of the enemy combatants. Each player may customize their arsenal of weapons and accessories at the beginning of every match, with currency being earned after the end of each round."
Sid Meier's Civilization V	"Sid Meier's Civilization V is a 4X video game in the Civilization series developed by Firaxis Games. The game was released on Microsoft Windows in September 2010,[3] on OS X on November 23, 2010, and on Linux on June 10, 2014. In Civilization V, the player leads a civilization from prehistoric times into the future on a procedurally generated map, attempting to achieve one of a number of different victory conditions through research, exploration, diplomacy, expansion, economic development, government and military conquest. The game is based on an entirely new game engine with hexagonal tiles instead of the square tiles of earlier games in the series.[5] Many elements from Civilization IV and its expansion packs have been removed or changed, such as religion and espionage (although these were reintroduced in its subsequent expansions). The combat system has been overhauled, by removing stacking of military units and enabling cities to defend themselves by firing directly on nearby enemies.[6] In addition, the maps contain computer-controlled city-states and non-player characters that are available for trade, diplomacy and conquest. A civilization's borders also expand one tile at a time, favoring more productive tiles,[7] and roads now have a maintenance cost, making them much less common.[8] The game features community, modding, and multiplayer elements.[5] It is available for download on Steam."
Counter-Strike Source	"Counter-Strike: Source is a remake of Counter-Strike using the Source game engine. As in the original, Counter-Strike: Source pits a team of counter-terrorists against a team of terrorists in a series of rounds. Each round is won either by completing an objective (such as detonating a bomb or rescuing hostages) or by eliminating all members of the enemy team. Counter-Strike: Source retains its team-based objective-orientated first-person shooter style gameplay. The aim of playing a map is to accomplish a map's objective: defusing the bomb, rescuing all hostages, or killing the entire opposing team. The ultimate goal of the game is to win more rounds than the opposing team. Once players are killed, they do not respawn until the next round, though this depends on which server people play on. This gameplay feature distinguishes Counter-Strike from other first-person shooter games, where players respawn instantly or after a short delay. Shooting while moving dramatically decreases accuracy, and holding the trigger down to continuously shoot produces severe recoil. The severity of damage induced by weaponry is dependent upon the specific locations of hits, with hits to the head being most lethal and shots which make contact elsewhere causing lesser loss of health. Damage is also affected by the distance, and if the target wears protection."
The Elder Scrolls V Skyrim	"The Elder Scrolls V: Skyrim is an action role-playing video game developed by Bethesda Game Studios and published by Bethesda Softworks. It is the fifth main installment in The Elder Scrolls series, following The Elder Scrolls IV: Oblivion, and was originally released worldwide for Microsoft Windows, PlayStation 3, and Xbox 360 on November 11, 2011. The game's main story revolves around the player character's quest to defeat Alduin the World-Eater, a dragon who is prophesied to destroy the world. The game is set 200 years after the events of Oblivion and takes place in the fictional province of Skyrim. Over the course of the game, the player completes quests and develops the character by improving skills. The game continues the open-world tradition of its predecessors by allowing the player to travel anywhere in the game world at any time, and to ignore or postpone the main storyline indefinitely."
Garry's Mod	"Garry's Mod (commonly abbreviated as GMod) is a sandbox physics game developed by Facepunch Studios and published by Valve Corporation. Garry's Mod was originally a mod created by Garry Newman for Valve Corporation's Half-Life 2 but was later made into a standalone release in 2006 for Microsoft Windows.[1] Later updates saw an OS X port, added in 2010, and a version for Linux in 2013. The base game mode ""sandbox"" has no set objectives, and gives the player the freedom to spawn non-player characters (NPCs), ragdolls or objects (called props), such as furniture, shipping containers, dumpsters and explosions, and interact with them in various ways."
Call of Duty Modern Warfare 2 - Multiplayer	"Call of Duty: Modern Warfare 2 is a first-person shooter video game developed by Infinity Ward and published by Activision. It was released worldwide on November 10, 2009 for Microsoft Windows, the PlayStation 3, and Xbox 360.[2] A version for OS X was developed by Aspyr and released on May 20, 2014. The Xbox 360 version was made backward compatible for the Xbox One in 2018. It is the sixth installment of the Call of Duty series[3]and the direct sequel to Call of Duty 4: Modern Warfare, continuing the same storyline.[4][5] It was released in conjunction with two other Call of Duty games: Call of Duty: Modern Warfare: Mobilized for the Nintendo DS,[6] and Call of Duty: Modern Warfare: Reflex, a port of Call of Duty 4 adapted by Treyarch for the Wii console.[7] The game's campaign follows the Task Force 141, a special forces unit fronted by Captain Soap MacTavish, as they hunt Vladimir Makarov, leader of the Russian Ultranationalist party, and the United States Army Rangers, who are defending the country from a Russian invasion. The game's main playable characters are Sergeant Gary ""Roach"" Sanderson, of the 141, and Private James Ramirez, of the Army Rangers, with Captain MacTavish becoming playable later in the campaign. An expansive multiplayer mode is featured in the game, with several new features and modes that were not seen in its predecessor."
Left 4 Dead 2	"Left 4 Dead 2 is a cooperative first-person shooter video game developed and published by Valve Corporation. The sequel to Turtle Rock Studios's Left 4 Dead, the game was released for Microsoft Windows and Xbox 360 in November 2009, and for OS X in October 2010, and for Linux in July 2013.[1][2] Left 4 Dead 2 builds upon cooperatively focused gameplay and Valve's proprietary Source engine, the same game engine used in the original Left 4 Dead. Set during the aftermath of an apocalyptic pandemic, Left 4 Dead 2focuses on four new Survivors, fighting against hordes of zombies, known as the Infected, who develop severe psychosis and act extremely aggressive. The Survivors must fight their way through five campaigns, interspersed with safe houses that act as checkpoints, with the goal of escape at each campaign's finale. The gameplay is procedurally altered by the ""AI Director 2.0"", which monitors the players' performance and adjusts the scenario to provide a dynamic challenge. Other new features include new types of special infected and an arsenal of melee weapons.[3]"
Football Manager 2013	"Football Manager 2013 (often abbreviated to FM13) is a 2012 football management simulation video game developed by Sports Interactive and published by Sega. It was released on Microsoft Windows and OS X on 2 November 2012.[1] Football Manager Handheld 2013 was subsequently published for PlayStation Portable on 30 November,[2] and for iOS and Android on 13 December. FM13 features similar gameplay to that of the Football Manager series. Gameplay consists of taking charge of a professional[a] association football team, as the team manager. Players can sign football players to contracts, manage finances for the club, and give team talks to players. FM19 is a simulation of real world management, with the player being judged on various factors by the club's AI owners and board. FM13 includes a quicker mode of play, called ""Football Manager Classic"". This new mode allow gamers to complete a season in less time than the normal game mode. It retains the 3D match engine and player/staff database, but simplifies the way players manage their club and allows them to focus on selected key areas to build success. A player can complete a season in approximately seven hours of gameplay."
Football Manager 2012	"Football Manager 2012 (abbreviated to FM12) is a football management-simulation video game. It was released on Microsoft Windows and Mac OS X on 21 October 2011.[2] FM12 is the eighth game in the Football Managerseries. FM12 features similar gameplay to that of the Football Manager series. Gameplay consists of taking charge of a Professional association football team, as the team manager. Players can sign football players to contracts, manage finances for the club, and give team talks to players. FM19 is a simulation of real world management, with the player being judged on various factors by the club's AI owners and board. FM12 added increased levels of scouting, including the amount of information a scout would bring back for in-game players. The largest new addition to the game was the ability to add or remove playable leagues from the game at the end of every season. "
Football Manager 2014	"Football Manager 2014 (commonly abbreviated to FM14) is a football management simulation video game developed by Sports Interactive and published by Sega. It was released on Microsoft Windows, OS X, Linux on 30 October 2013. A handheld version titled Football Manager Handheld 2014 was released for iOS and Android on 14 November 2013. A PlayStation Vita version titled Football Manager Classic 2014 was released on 11 April 2014. FM14 features similar gameplay to that of the Football Manager series. Gameplay consists of taking charge of a professional[a] association football team, as the team manager. Players can sign football players to contracts, manage finances for the club, and give team talks to players. FM19 is a simulation of real world management, with the player being judged on various factors by the club's AI owners and board. FM14 features a revamped transfer module where opposing clubs and managers adopt a more realistic approach when making or responding to transfer offers. In addition, a number of new ‘real world’ transfer clauses have been added, such as the ability to loan a player back to the club he’s just been bought from and the option to offer a combination of cash and loan players, as well as new contract clauses such as a sub bench appearance fee. The old ‘turn-based’ system of transfer negotiations can now be done two ways, the tried and tested system and a new ‘live’ system, similar to that used in Football Manager's contract negotiations."
Terraria	"Terraria is a 2D action-adventure sandbox video game developed by Re-Logic. The game was initially released for Microsoft Windows in May 2011, and has since been released for various consoles, handhelds, and mobile devices. Gameplay of Terraria features exploration, crafting, building, and combat with a variety of creatures in a procedurally generated 2D world. Terraria received generally positive critical reception upon release, with direct comparisons to Minecraft and praise given to its sandbox elements. By September 2018, the game had sold over 25 million copies across all platforms. Terraria is a sandbox 2D game with gameplay that revolves around exploration, building, combat, and mining.[1][2] The game has a 2D sprite tile-based graphical style reminiscent of the 16-bit sprites found on the Super NES.[2] The game is noted for its classic exploration-adventure style of gameplay, similar to titles such as the Metroid series and Minecraft. The game starts in a procedurally generated world. The player starts with three basic tools: a pickaxe for mining, a shortsword for combat, and an axe for woodcutting.[1] Many resources, notably ores, can be found while mining or exploring underground caves. The player begins with a limited amount of health and magic points, which can both be increased by finding certain items by exploring.[1] Some resources, and most items, may only be found in certain areas of the map, stored in common and rare containers, or dropped by certain enemies.[1] The player uses resources to craft new items and equipment at an appropriate crafting station for that recipe. For example, tables or other items can be crafted at a work bench, and bars can be smelted from ore at a furnace. Several advanced items in Terraria require multiple crafting operations where the product of one recipe is used as an ingredient for another."
Warframe	"Warframe is a free-to-play cooperative third-person shooter video game developed and published by Digital Extremes. Originally released for Microsoft Windows in March 2013, it was later ported to the PlayStation 4, Xbox One, and will release on the Nintendo Switch November 20 2018. In Warframe, players control members of the Tenno, a race of ancient warriors who have awoken from centuries of cryosleep to find themselves at war in a planetary system with different factions. The Tenno use their powered Warframes along with powerful weapons and abilities to complete missions. The game includes elements of shooting and melee games, parkour, and role-playing to allow players to advance their Tenno character with improved gear. The concepts for Warframe had been in place at Digital Extremes since 2000 under the name Dark Sector. The company reintroduced Dark Sector in 2004 in preparation for release on the upcoming seventh generation consoles but could not find a publisher due to its theme. Ultimately Digital Extremes released a game called Dark Sector in 2008, far different from their original plan. By 2012, looking at the success of free-to-play games, the developers took their earlier Dark Sector ideas and art assets, to present it as Warframe."
Football Manager 2015	"Football Manager 2015 (abbreviated to FM15) is a football management simulation video game developed by Sports Interactive and published by Sega. It was released on Microsoft Windows, OS X, and Linux platforms on 7 November 2014, and on iOS and Android platforms on 20 November 2014. FM15 features similar gameplay to that of the Football Manager series. Gameplay consists of taking charge of a professional[a] association football team, as the team manager. Players can sign football players to contracts, manage finances for the club, and give team talks to players. FM19 is a simulation of real world management, with the player being judged on various factors by the club's AI owners and board. The game offers a variety of new features such as being the first game of the franchise to include Twitch integration so people can stream their game online. There has been an overhaul in the match engine, adding 2000 new animations into the game, improved ball physics and improved shots, passes, long balls etc.The player models have also been updated adding new realism into the game along with a brand new lighting model. FM15 featured a complete redesign of the game's interface, introducing a new sidebar giving a new look on Football Manager 2015. Managers now choose between being a ""Tracksuit"" manager or a ""Tactical"" manager; when designing a new avatar. A Tracksuit manager specialises in training; and on the field knowledge, whilst a tactical manager specialises in tactics, formations and player morale.[3]"
Arma 3	"ARMA 3[N 1] is an open-world, realism-based, military tactical shooter video game developed and published by Bohemia Interactive. It was released for Microsoft Windows in September 2013, and later announced for OS Xand Linux in August 2015. ARMA 3's storyline takes place in the mid-2030s during the fictional Operation Magnitude, a military operation launched by NATO forces fighting in Europe against ""Eastern armies"" referred to as Canton-Protocol Strategic Alliance Treaty (CSAT), led by a resurgent Iranian military with a coalition of other Middle Eastern and Asian nations, such as China. The single-player campaign has the player take control of U.S. Army soldier Corporal Ben Kerry. During the campaign, the player will face everything from lone wolf infiltration missions to the commanding of large scale armored operations. The player will be able to choose different objectives and weaponry (such as UAVs, artillery, and air support) according to their play style. ARMA 3 takes place on the Aegean-based islands of Altis and Stratis,[8] and the South Pacific island of Tanoa. The islands feature photo-realistic terrain and water environments. Altis is the largest official terrain in the ARMAseries with ground area covering approximately 270 square kilometres (100 sq mi). The smaller island, Stratis, expands over an area of 20 square kilometres (7.7 sq mi).[9]"
Grand Theft Auto V	"Grand Theft Auto V is an action-adventure video game developed by Rockstar North and published by Rockstar Games. It was released in September 2013 for PlayStation 3 and Xbox 360, in November 2014 for PlayStation 4 and Xbox One, and in April 2015 for Microsoft Windows. It is the first main entry in the Grand Theft Auto series since 2008's Grand Theft Auto IV. Set within the fictional state of San Andreas, based on Southern California, the single-player story follows three criminals and their efforts to commit heists while under pressure from a government agency. The open world design lets players freely roam San Andreas' open countryside and the fictional city of Los Santos, based on Los Angeles.The game is played from either.third-person or first-person perspective and its world is navigated on foot or by vehicle. Players control the three lead protagonists throughout single-player and switch between them both during and outside missions. The story is centred on the heist sequences, and many missions involve shooting and driving gameplay. A ""wanted"" system governs the aggression of law enforcement response to players who commit crimes. Grand Theft Auto Online, the game's online multiplayer mode, lets up to 30 players engage in a variety of different cooperative and competitive game modes"
Borderlands 2	"Borderlands 2 is an open world action role-playing first-person shooter video game developed by Gearbox Software and published by 2K Games.[4] It is the second game in the Borderlands series and the sequel to 2009's Borderlands. The game was released for Microsoft Windows, PlayStation 3, Xbox 360, and OS X on September 18, 2012. It was ported to the PlayStation Vita on May 13, 2014, and released for Linux on September 30, 2014.[1] Borderlands 2 allows players to complete a campaign consisting of central quests and optional side-missions as one of four (six including downloadable content) treasure seekers, ""Vault Hunters"", on the planet Pandora. Key gameplay features from its predecessor, such as online collaborative campaign gameplay, randomly generated loot, such as weapons and shields and character-building elements commonly found in role-playing video gamesare in Borderlands 2."
Empire Total War	"Empire: Total War is a turn-based strategy and real-time tactics video game developed by Creative Assembly and published by Sega. The fifth installment in the Total War series, the game was released in 2009. The game, which focuses on the early modern period of the 18th century, was announced at the Leipzig Games Convention in August 2007. The Mac OS X version of the game was released by Feral Interactive on 10 June 2014. The Linux version was released, also by Feral Interactive, on 8 December 2014. Players choose an 18th-century faction and set out to achieve domination over the known world through military force, diplomacy, espionage and economics. The interface and play are similar to earlier Total War titles: although the campaign element of the game is turn-based, players can direct battles in real-time. Empire: Total War is the first game in the series to allow naval battles to be conducted in real-time. In addition to the standard campaign mode, a special campaign follows the development of the United States from the settlement of Jamestown to the American War of Independence. Players may also recreate several historical battles from the early modern era, such as the Battle of Fontenoy, Battle of Rossbach, Battle of Brandywine Creek and Battle of Lagos."
